id,source,author,title,description,url,published_at,content
79,CNET,Geoffrey Morrison,How Do Transparent TVs Work? - CNET,"They look like the work of science-fiction, but they're real and soon you can buy one for your home. How do transparent TVs actually work?",https://www.cnet.com/tech/home-entertainment/how-do-transparent-tvs-work/,2024-05-22T10:00:09Z,"At CES in January, both LG and Samsung showed off transparent TVs. These seemingly magical devices can show an image just like a regular TV, except you can also see right through them. Images seem to… [+8535 chars]"
80,Biztoc.com,marketwatch.com,"The 2025 Lincoln Aviator is plush, comfortable and loaded with tech. Welcome to the palace","The 2025 Lincoln Aviator midsize luxury SUV brings comfort and technology to the forefront, backed up by a powerful engine. #lincolnaviator",https://biztoc.com/x/54aaa1c9c832abf1,2024-05-22T10:00:06Z,"The 2025 Lincoln Aviator midsize luxury SUV brings comfort and technology to the forefront, backed up by a powerful engine.
#lincolnaviator
This story appeared on marketwatch.com, 2024-05-22."
81,[Removed],NULL,[Removed],[Removed],https://removed.com,1970-01-01T00:00:00Z,[Removed]
82,Mother Jones,Dan Friedman,A Chinese Mogul With Deep MAGA Ties Is Going on Trial for Massive Fraud,"The trial of fugitive Chinese mogul Guo Wengui kicks off in New York Wednesday, as federal prosecutors prepare to lay out what they have called a “complex” conspiracy involving elaborate financial schemes, dozens of offshore accounts, and evidence translated …",https://www.motherjones.com/politics/2024/05/miles-guo-wengui-trial-bannon-trump/,2024-05-22T10:00:02Z,"Mother Jones; Ron Sachs/CNP/ZUMA; Anna Moneymaker; Don Emmert/AFP/Getty (2)
Fight disinformation: Sign up for the free Mother Jones Daily newsletter and follow the news that matters.
The trial of f… [+10255 chars]"
83,Newsweek,Eileen Falkenberg-Hull,2024 Ford F-150 PowerBoost Review: A Better Hybrid Than It Used to Be,"The latest generation of Ford F-150 features a revised hybrid setup that delivers proficient power, but still suffers from a cohesiveness crisis.",https://www.newsweek.com/2024-ford-f-150-powerboost-review-better-hybrid-it-used-1902545,2024-05-22T10:00:02Z,"The Ford F-150 full-size pickup truck has been offered with a hybrid engine option for a few years. Though a more eco-friendly solution to power than a V8, the engine-transmission combination was der… [+5133 chars]"
84,Newsweek,Newsweek Staff,Fiction and Nonfiction Book Picks for Every Reader This Summer,Newsweek staff helps you find the perfect book for your summer reading pleasure—from mysteries and historical fiction to Black history and the Royals.,https://www.newsweek.com/2024/06/07/fiction-nonfiction-book-picks-every-reader-this-summer-1901624.html,2024-05-22T10:00:01Z,"Long summer days and vacations go hand-in-hand. Whether you enjoy your holidays basking in the sun on a chaise lounge, traveling the world or relaxing on a staycation, a good book just improves the v… [+12295 chars]"
85,CNBC,NULL,Transition to next-generation AI chips and 2 other pressing questions ahead of Nvidia's earnings,"Wall Street is once again expecting Nvidia to deliver a beat-and-raise report. We await details on the Blackwell ramp, software revenue growth and margins.",https://www.cnbc.com/2024/05/22/nvidia-earnings-blackwell-transition-2-other-questions-ahead-of-report.html,2024-05-22T10:00:01Z,Stop us if you've heard this one before: A high bar has been set for Nvidia 's upcoming earnings report. But just because it's been the case for the past three quarters does not make it less true Wed… [+8102 chars]
86,Aps.org,"M. Kristen, J. N. Voss, M. Wildermuth, A. Bilmes, J. Lisenfeld, H. Rotzinger, and A. V. Ustinov",Giant Two-Level Systems in a Granular Superconductor,"Author(s): M. Kristen, J. N. Voss, M. Wildermuth, A. Bilmes, J. Lisenfeld, H. Rotzinger, and A. V. UstinovA class of strongly coupled two-level systems is revealed in experiments with compact microwave resonators fabricated from granular aluminum thin films.[…",https://link.aps.org/doi/10.1103/PhysRevLett.132.217002,2024-05-22T10:00:00Z,"Disordered thin films are a common choice of material for superconducting, high impedance circuits used in quantum information or particle detector physics. A wide selection of materials with differe… [+1390 chars]"
87,Aps.org,Máté Farkas,Unbounded Device-Independent Quantum Key Rates from Arbitrarily Small Nonlocality,Device-independent quantum key distribution allows for proving the security of a shared cryptographic key between two distant parties with potentially untrusted devices. The security proof is based on the measurement outcome statistics (correlation) of a Bell…,https://link.aps.org/doi/10.1103/PhysRevLett.132.210803,2024-05-22T10:00:00Z,Device-independent quantum key distribution allows for proving the security of a shared cryptographic key between two distant parties with potentially untrusted devices. The security proof is based o… [+1426 chars]
88,Aps.org,R. Pompili et al.,Guiding of Charged Particle Beams in Curved Plasma-Discharge Capillaries,We present a new approach that demonstrates the deflection and guiding of relativistic electron beams over curved paths by means of the magnetic field generated in a plasma-discharge capillary. We experimentally prove that the guiding is much less affected by…,https://link.aps.org/doi/10.1103/PhysRevLett.132.215001,2024-05-22T10:00:00Z,We present a new approach that demonstrates the deflection and guiding of relativistic electron beams over curved paths by means of the magnetic field generated in a plasma-discharge capillary. We ex… [+802 chars]
89,Aps.org,Kasper Poulsen and Nikolaj T. Zinner,Heat-based circuits using quantum rectification,"With the increased power consumption of modern computer components, heat-based circuitry has become ever more relevant due to a lower power expense to process logic bits of information. In heat-based circuits, computations are performed by driving heat curren…",https://link.aps.org/doi/10.1103/PhysRevA.109.052223,2024-05-22T10:00:00Z,"With the increased power consumption of modern computer components, heat-based circuitry has become ever more relevant due to a lower power expense to process logic bits of information. In heat-based… [+997 chars]"
90,GlobeNewswire,Global Market Insights Inc.,"C4ISR Market to reach USD 150 Bn by 2032, Says Global Market Insights inc.",C4ISR Industry size is expected to register 4% CAGR between 2023 and 2032 propelled by the government investments in the modernization of military & defense. C4ISR Industry size is expected to register 4% CAGR between 2023 and 2032 propelled by the government…,https://www.globenewswire.com/news-release/2024/05/22/2886314/0/en/C4ISR-Market-to-reach-USD-150-Bn-by-2032-Says-Global-Market-Insights-inc.html,2024-05-22T10:00:00Z,"Selbyville, Delaware, May 22, 2024 (GLOBE NEWSWIRE) -- C4ISR Market size may reach USD 150 billion in revenue by 2032, as per a recent study
 by Global Market Insights Inc.
The growing need to impr… [+4651 chars]"
91,MIT Technology Review,Zeyi Yang,OpenAI’s latest blunder shows the challenges facing Chinese AI models,"This story first appeared in China Report, MIT Technology Review’s newsletter about technology in China. Sign up to receive it in your inbox every Tuesday. Last week’s release of GPT-4o, a new AI “omnimodel” that you can interact with using voice, text, or vi…",https://www.technologyreview.com/2024/05/22/1092763/openais-gpt4o-chinese-ai-data/,2024-05-22T10:00:00Z,"In fact, among the few long Chinese tokens in GPT-4o that arent either pornography or gambling nonsense, two are socialism with Chinese characteristics and Peoples Republic of China. The presence of … [+2139 chars]"
92,Aps.org,Petr Marek,Ground State Nature and Nonlinear Squeezing of Gottesman-Kitaev-Preskill States,"The main bottleneck for universal quantum computation with traveling light is the preparation of Gottesman-Kitaev-Preskill states of sufficient quality. This is an extremely challenging task, experimental as well as theoretical, also because there is currentl…",https://link.aps.org/doi/10.1103/PhysRevLett.132.210601,2024-05-22T10:00:00Z,"The main bottleneck for universal quantum computation with traveling light is the preparation of Gottesman-Kitaev-Preskill states of sufficient quality. This is an extremely challenging task, experim… [+560 chars]"
93,ComputerWeekly.com,Sebastian Klovig Skelton,AI Seoul Summit: 27 nations and EU to set red lines on AI risk,"The countries will now work together to identify thresholds at which the risks presented by an AI model or system would be unacceptable without safeguards in place, as well as develop interoperable safety testing regimes for the technology",https://www.computerweekly.com/news/366585944/AI-Seoul-Summit-27-nations-and-EU-to-set-red-lines-on-AI-risk,2024-05-22T10:00:00Z,"More than two dozen countries have committed to developing shared riskthresholds for frontier artificial intelligence (AI) models to limit their harmful impacts, as part of an agreement to promote sa… [+6160 chars]"
94,Aps.org,Graziano Amati,Dynamical signatures of non-Markovianity in a dissipative-driven qubit,We investigate signatures of non-Markovianity in the dynamics of a periodically driven qubit coupled to a dissipative bosonic environment. We propagate the dynamics of the reduced density matrix of the qubit by integrating the numerically exact hierarchical e…,https://link.aps.org/doi/10.1103/PhysRevA.109.052433,2024-05-22T10:00:00Z,We investigate signatures of non-Markovianity in the dynamics of a periodically driven qubit coupled to a dissipative bosonic environment. We propagate the dynamics of the reduced density matrix of t… [+1327 chars]
95,Computerworld,Evan Schuman,Trying to keep AI from sneaking into your environment? Good luck!,"Enterprise IT today has generative AI hitting it from every angle: from systems that it directly licenses for millions of dollars, from large language models and other genAI algorithms that are sneaking into every SaaS product globally, from employees and con…",https://www.computerworld.com/article/2108511/trying-to-keep-ai-from-sneaking-into-your-environment-good-luck.html,2024-05-22T10:00:00Z,"“Within three years, programmers will not be writing most code. AI will,” she predicted, with 60% to 70% of code being created by AI in that timeframe. “We can’t manage and govern this [AI] space [in… [+1172 chars]"
96,GlobeNewswire,ProcessMaker,ProcessMaker Wins Top Award as 2024 Best Generative AI Solution from SIIA CODiE,"Recognized for superior innovation, user-friendliness and problem solving through GenAI Recognized for superior innovation, user-friendliness and problem solving through GenAI",https://www.globenewswire.com/news-release/2024/05/22/2886315/0/en/ProcessMaker-Wins-Top-Award-as-2024-Best-Generative-AI-Solution-from-SIIA-CODiE.html,2024-05-22T10:00:00Z,"Durham, North Carolina, May 22, 2024 (GLOBE NEWSWIRE) -- ProcessMaker, a business process automation platform, announces that ProcessMaker Platform was named the 2024 SIIA CODiE Award Winner in the B… [+3130 chars]"
97,Forbes,"Christian Pedersen, Forbes Councils Member, 
 Christian Pedersen, Forbes Councils Member
 https://www.forbes.com/sites/forbestechcouncil/people/christianpedersen/",Agility Matters: Elements For Embracing More Sustainable Business Models,The inevitable shift toward a circular economy raises essential questions for nearly every manufacturer.,https://www.forbes.com/sites/forbestechcouncil/2024/05/22/agility-matters-elements-for-embracing-more-sustainable-business-models/,2024-05-22T10:00:00Z,"Chief Product Officer at IFS with a passion for developing and adapting technology that adds differentiating value for businesses.
getty
According to Gartner, ""the circular economy will be the only… [+7192 chars]"
98,Computerworld,JR Raphael,Gemini is the new Google+,"Allow me to paint a purely hypothetical picture for you — for, erm, no reason in particular.




Imagine the following conversation about a groundbreaking new product someone is really excited to show you. I’ll take the liberty of playing the role of you and…",https://www.computerworld.com/article/2117752/google-gemini-ai.html,2024-05-22T10:00:00Z,"And let’s be brutally honest for a second: Google’s Gemini system is not that technology. Not in its current form, anyhow, nor in the way Google is scrambling to cram it into every possible nook and … [+1201 chars]"
99,Forbes,"David Prosser, Contributor, 
 David Prosser, Contributor
 https://www.forbes.com/sites/davidprosser/",UnifyApps Raises $11 Million Seed Round For One App To Rule Them All,"With the typical enterprise company now running more than 400 apps that aren't connected to one another, UnifyApps thinks its integration platform is the answer",https://www.forbes.com/sites/davidprosser/2024/05/22/unifyapps-raises-11-million-seed-round-for-one-app-to-rule-them-all/,2024-05-22T10:00:00Z,"UnifyApps co-founders, led by Pavitar Singh (centre)
UnifyApps
The software-as-a-service (Saas) revolution has transformed the technology infrastructures of companies worldwide for the better. Indi… [+3918 chars]"
100,Forbes,"Mark Sparrow, Senior Contributor, 
 Mark Sparrow, Senior Contributor
 https://www.forbes.com/sites/marksparrow/",New And Improved NuPhy Halo75 V2 Is A Keyboard Worth Tapping Into,The latest version of the NuPhy Halo75 has seen significant improvements and upgrades. This is twice the keyboard that the original version was. Well worth the upgrade.,https://www.forbes.com/sites/marksparrow/2024/05/22/new-and-improved-nuphy-halo75-v2-is-a-keyboard-worth-tapping-into/,2024-05-22T10:00:00Z,"The new and improved NuPhy Halo75 V2 mechanical keyboard is available in five colorways, including ... [+] three new cocktail-inspired Sakura Fizz, Mojito and Blue Lagoon.
Nuphy
Keyboard maker NuPh… [+7689 chars]"
