id,source,author,title,description,url,published_at,content
39,InvestorsObserver,InvestorsObserver,TSOLife Launches Innovative Transportation Management Tool,"TSOLife Launches Innovative Transportation Management Tool           PR Newswire             Tampa   -based technology company, TSOLife, debuts new transportation management tool designed for senior living communities.           TAMPA, Fla.     ,     M...",https://www.investorsobserver.com/news/qm-pr/7926633687378333,2024-05-22T10:15:00Z,"Tampa
-based technology company, TSOLife, debuts new transportation management tool designed for senior living communities.
TAMPA, Fla.
,
May 22, 2024
/PRNewswire/ -- TSOLife, the premier reside… [+2289 chars]"
40,Gizchina.com,Abdullah,Mobile Processor: Huawei Surpasses Google in Units Shipped,"The first quarter of 2024 has brought interesting developments in the mobile processor (SoC) market, with established players like Apple and Qualcomm facing resurgent competition ...
The post Mobile Processor: Huawei Surpasses Google in Units Shipped appeared…",https://www.gizchina.com/2024/05/22/mobile-processor-huawei-surpasses-google-in-units-shipped/,2024-05-22T10:12:00Z,"The first quarter of 2024 has brought interesting developments in the mobile processor (SoC) market, with established players like Apple and Qualcomm facing resurgent competition from Chinese compani… [+8964 chars]"
41,ETF Daily News,MarketBeat News,"Premier, Inc. (NASDAQ:PINC) Insider Andy Brailo Sells 8,331 Shares of Stock","Premier, Inc. (NASDAQ:PINC – Get Free Report) insider Andy Brailo sold 8,331 shares of the business’s stock in a transaction that occurred on Monday, May 20th. The shares were sold at an average price of $19.64, for a total value of $163,620.84. Following the…",https://www.etfdailynews.com/2024/05/22/premier-inc-nasdaqpinc-insider-andy-brailo-sells-8331-shares-of-stock/,2024-05-22T10:10:42Z,"Premier, Inc. (NASDAQ:PINC – Get Free Report) insider Andy Brailo sold 8,331 shares of the business’s stock in a transaction that occurred on Monday, May 20th. The shares were sold at an average pric… [+4631 chars]"
42,BusinessLine,BL Kochi Bureau,Coconut Development Board urged to prevent adulteration in coconut oil,COMA President emphasized the need for keeping quality standards in coconut oil production and requested the support of the Board in preventing adulteration of coconut oil,https://www.thehindubusinessline.com/economy/agri-business/coconut-development-board-urged-to-prevent-adulteration-in-coconut-oil/article68203044.ece,2024-05-22T10:09:40Z,"To facilitate interaction with major stakeholders on quality management and food safety standards, Coconut Development Board organized one day seminar on prospects and challenges in the coconut oil s… [+1124 chars]"
43,Livemint,Krishna Yadav,Delhi High Court to hear Tesla vs Tesla Power case next on 28 May,"The court had previously said that Gurugram-based Tesla Power, accused of trademark infringement by Elon Musk's firm, had been operating for four years and deserved an opportunity to present its case.",https://www.livemint.com/companies/news/delhi-high-court-to-hear-tesla-vs-tesla-power-case-next-on-28-may-11716370397975.html,2024-05-22T10:08:38Z,New Delhi: The Delhi High Court will hear Tesla Inc's trademark infringement case against Gurugram-based Tesla Power India Pvt Ltd next on 28 May. The case was initially slated to be heard by Justice… [+2727 chars]
44,Financial Post,Business Wire,Beacon Launches with CAD $5.25M Seed Round to Develop Purpose-Built Super App Supporting Canadian Immigrant Journey,"TORONTO — Beacon, a new solution built to facilitate smooth transitions for immigrants relocating to Canada, has completed a CAD $5.25 million seed round and officially launched in the Canadian market. This investment was supported by prominent figures in the…",https://financialpost.com/pmn/business-wire-news-releases-pmn/beacon-launches-with-cad-5-25m-seed-round-to-develop-purpose-built-super-app-supporting-canadian-immigrant-journey,2024-05-22T10:07:51Z,"TORONTO Beacon, a new solution built to facilitate smooth transitions for immigrants relocating to Canada, has completed a CAD $5.25 million seed round and officially launched in the Canadian market.… [+4662 chars]"
45,Financial Post,Business Wire,HYAS Infosec Named “Best Overall Healthcare Cybersecurity Company” in 8th Annual MedTech Breakthrough Awards Program,"HYAS Insight Advanced Threat Intelligence and HYAS Protect Protective DNS Proactively Thwart Attacks on the Healthcare Sector Before Damage Can Occur VANCOUVER, British Columbia — HYAS Infosec, the adversary infrastructure platform provider that offers unpara…",https://financialpost.com/pmn/business-wire-news-releases-pmn/hyas-infosec-named-best-overall-healthcare-cybersecurity-company-in-8th-annual-medtech-breakthrough-awards-program,2024-05-22T10:07:46Z,"Author of the article:
HYAS Protect immediately identifies attempted communication to malicious domains and infrastructure external to an organization. As part of a zero-trust architecture, it enabl… [+9781 chars]"
46,Financial Post,Business Wire,"Enhanced Experian Ascend Technology Platform™ Transforms Software for Credit, Fraud and Analytics","First-of-its-kind platform now integrates Experian’s market-leading data, generative AI and cutting-edge machine learning solutions into one unified interface COSTA MESA, Calif. — As companies around the globe grapple with an accelerated pace of change and se…",https://financialpost.com/pmn/business-wire-news-releases-pmn/enhanced-experian-ascend-technology-platform-transforms-software-for-credit-fraud-and-analytics,2024-05-22T10:07:31Z,"Author of the article:
Article content
First-of-its-kind platform now integrates Experians market-leading data, generative AI and cutting-edge machine learning solutions into one unified interface
… [+10441 chars]"
47,Financial Post,Business Wire,Netcracker Receives Awards for Achievements in Customer Experience and Automation from FutureNet World,"Netcracker Honored for Most Innovative Application of AI to Enhance Customer Experience and Leading Solution for Network Automation WALTHAM, Mass. — Netcracker Technology announced today that it has won two awards from FutureNet World: the Customer Experience…",https://financialpost.com/pmn/business-wire-news-releases-pmn/netcracker-receives-awards-for-achievements-in-customer-experience-and-automation-from-futurenet-world,2024-05-22T10:07:21Z,"Netcracker Honored for Most Innovative Application of AI to Enhance Customer Experience and Leading Solution for Network Automation
WALTHAM, Mass. Netcracker Technology announced today that it has w… [+3317 chars]"
48,Semrush.com,NULL,The Ultimate Keyword Research Checklist for 2024,Here‘s a step-by-step keyword research checklist to help you rank for your target keywords.,https://www.semrush.com/blog/keyword-research-checklist/,2024-05-22T10:07:00Z,"This is a step-by-step keyword research checklist to help you rank higher in unpaid search results. And drive more valuable traffic to your site.
Weve used these steps on our blog to rank for over 1… [+11699 chars]"
49,Marketscreener.com,NULL,Dycom Industries : Q1 2025 Presentation Materials,"(marketscreener.com) 
 
 st
 
 
 May 22, 2024
 
 
 
 
 Participants
 
 
 
 
 
 Steven E. Nielsen
 
 
 
 
 President and Chief Executive Officer
 
 
 
 
 
 
 ...https://www.marketscreener.com/quote/stock/DYCOM-INDUSTRIES-INC-12388/news/Dycom-Industries-Q1-2025…",https://www.marketscreener.com/quote/stock/DYCOM-INDUSTRIES-INC-12388/news/Dycom-Industries-Q1-2025-Presentation-Materials-46793042/,2024-05-22T10:06:09Z,"Important Information
Caution Concerning Forward-Looking Statements
This presentation contains forward-looking statements within the meaning of the 1995 Private Securities Litigation Reform Act. Th… [+4214 chars]"
50,Marketscreener.com,NULL,"Hightech Payment S A : HPS expands global footprint with new office in Pune, India","(marketscreener.com) 
 HPS expands global footprint with new office in Pune, India
 
 
 
 Date: 22 Mai 2024
 
 
 Download 
 
 
 Casablanca, 21 May 2024 - HPS, the leading global provider of payment software and services, is thrilled to announce the official o…",https://www.marketscreener.com/quote/stock/HIGHTECH-PAYMENT-SYSTEMS--1408706/news/Hightech-Payment-S-A-HPS-expands-global-footprint-with-new-office-in-Pune-India-46793040/,2024-05-22T10:06:08Z,"Casablanca, 21 May 2024 - HPS, the leading global provider of payment software and services, is thrilled to announce the official opening of its new office and delivery center in Pune, India, marking… [+3129 chars]"
51,Biztoc.com,theglobeandmail.com,"Yes, carbon capture is good","Madison Savilow is the director of corporate and external affairs for Carbon Upcycling. Carbon capture and storage (CCS) has long been touted as a way to help Canada achieve our global commitments to a reduced carbon footprint. Unfortunately, the development …",https://biztoc.com/x/281a9e2a2f3d757c,2024-05-22T10:06:06Z,Madison Savilow is the director of corporate and external affairs for Carbon Upcycling.Carbon capture and storage (CCS) has long been touted as a way to help Canada achieve our global commitments to … [+289 chars]
52,Geeky Gadgets,Julian Horsey,Sonos Ace headphones “Obsessively crafted and masterfully tuned”,"Sonos has officially entered the personal listening market with the launch of its first-ever headphones, Sonos Ace. These premium over-the-ear Bluetooth headphones are designed to deliver an unparalleled audio experience, combining Sonos’ renowned sound quali…",https://www.geeky-gadgets.com/sonos-ace-headphones/,2024-05-22T10:05:37Z,"Sonos has officially entered the personal listening market with the launch of its first-ever headphones, Sonos Ace. These premium over-the-ear Bluetooth headphones are designed to deliver an unparall… [+3187 chars]"
53,PC Gamer,Nick Evanson,Microsoft's auto AI upscaler will only be available on Snapdragon-powered Copilot+ AI PCs to begin with,"And narrowing down its scope even further, it'll only work on a very small number of games.",https://www.pcgamer.com/hardware/microsofts-auto-ai-upscaler-will-only-be-available-on-snapdragon-powered-copilot-ai-pcs-to-begin-with/,2024-05-22T10:05:05Z,"Earlier this year, it came to light that Microsoft had been developing an AI upscaler for Windows, called Automatic Super Resolution (ASR). The concept behind the system is that any game can get a bo… [+3431 chars]"
54,Aero-news.net,editor@aero-news.net (Jim Campbell),B-21 Raider Continues Flight Test Program USAF Releases Inflight Photos,"USAF Releases Inflight Photos The Air Force is releasing dramatic inflight pix of the new B-21 Raider, now undergoing flight test. Following its formal unveiling, Dec. 2, 2022, the B-21 Raider began flight testing at Edwards Air Force Base where it continues …",https://www.aero-news.net/index.cfm?do=main.textpost&id=A30D74FF-BD73-4AAA-AB37-E5408D8CF1C2,2024-05-22T10:05:00Z,"The Air Force is releasing dramatic inflight pix of the new B-21 Raider, now undergoing flight test. 
Following its formal unveiling, Dec. 2, 2022, the B-21 Raider began flight testing at Edwards Ai… [+1600 chars]"
55,ETF Daily News,MarketBeat News,"Principal Financial Group Inc. Sells 1,048 Shares of Dolby Laboratories, Inc. (NYSE:DLB)","Principal Financial Group Inc. lowered its position in Dolby Laboratories, Inc. (NYSE:DLB – Free Report) by 0.5% during the 4th quarter, according to the company in its most recent Form 13F filing with the SEC. The institutional investor owned 218,617 shares …",https://www.etfdailynews.com/2024/05/22/principal-financial-group-inc-sells-1048-shares-of-dolby-laboratories-inc-nysedlb/,2024-05-22T10:04:41Z,"Principal Financial Group Inc. lowered its position in Dolby Laboratories, Inc. (NYSE:DLB – Free Report) by 0.5% during the 4th quarter, according to the company in its most recent Form 13F filing wi… [+3715 chars]"
56,EURACTIV,Silvia Lorenzo Perez,"Governments spying on citizens: Who is to blame, what can the EU do?","Governments wield considerable influence in the cyber realm and must face accountability for their actions, argues CDT's Silvia Lorenzo Perez.",https://www.euractiv.com/section/digital/opinion/governments-spying-on-citizens-who-is-to-blame-what-can-the-eu-do/,2024-05-22T10:04:35Z,"In recent years, revelations about governments’ use of spyware to target political opponents and civil society represenatitives has been rampant. These actors need to face accountability for their ac… [+5569 chars]"
57,Marketscreener.com,NULL,Arnoldo Mondadori Editore S p A : Presentation PLAI – Mondadori Group Accelerator,"(marketscreener.com) 
 
 WHO WE ARE
 
 
 F o r g i n g t h e F u t u r e through Gen A.I. Talent
 
 
 PLAI is the Italian Accelerator igniting the growth of innovative Startups and nurturing a community of talents in the Generative AI field. Our mission is to…",https://www.marketscreener.com/quote/stock/ARNOLDO-MONDADORI-EDITORE-76275/news/Arnoldo-Mondadori-Editore-S-p-A-Presentation-PLAI-Mondadori-Group-Accelerator-46792992/,2024-05-22T10:04:08Z,"WHO WE ARE
F o r g i n g t h e F u t u r e through Gen A.I. Talent
PLAI is the Italian Accelerator igniting the growth of innovative Startups and nurturing a community of talents in the Generative … [+8536 chars]"
58,Marketscreener.com,NULL,Arnoldo Mondadori Editore S p A : Presentazione PLAI – Mondadori Group Accelerator,"(marketscreener.com) 
 
 WHO WE ARE
 
 
 F o r g i n g t h e F u t u r e through Gen A.I. Talent
 
 
 PLAI is the Italian Accelerator igniting the growth of innovative Startups and nurturing a community of talents in the Generative AI field. Our mission is to…",https://www.marketscreener.com/quote/stock/ARNOLDO-MONDADORI-EDITORE-76275/news/Arnoldo-Mondadori-Editore-S-p-A-Presentazione-PLAI-Mondadori-Group-Accelerator-46792991/,2024-05-22T10:04:08Z,"WHO WE ARE
F o r g i n g t h e F u t u r e through Gen A.I. Talent
PLAI is the Italian Accelerator igniting the growth of innovative Startups and nurturing a community of talents in the Generative … [+8536 chars]"
59,ETF Daily News,MarketBeat News,Janney Montgomery Scott LLC Buys 341 Shares of Silicon Motion Technology Co. (NASDAQ:SIMO),"Janney Montgomery Scott LLC raised its stake in Silicon Motion Technology Co. (NASDAQ:SIMO – Free Report) by 0.5% during the fourth quarter, according to the company in its most recent Form 13F filing with the SEC. The institutional investor owned 73,150 shar…",https://www.etfdailynews.com/2024/05/22/janney-montgomery-scott-llc-buys-341-shares-of-silicon-motion-technology-co-nasdaqsimo/,2024-05-22T10:02:42Z,"Janney Montgomery Scott LLC raised its stake in Silicon Motion Technology Co. (NASDAQ:SIMO – Free Report) by 0.5% during the fourth quarter, according to the company in its most recent Form 13F filin… [+4569 chars]"
60,Marketscreener.com,NULL,Elliptic Laboratories : Labs – Minutes of Annual General Meeting,"(marketscreener.com) 
 
 Oslo, 22 May 2024: The annual general meeting of Elliptic Laboratories ASA was held today. The minutes of the meeting, including appendices, are attached to this notice and will be made available on the Company's website, www.elliptic…",https://www.marketscreener.com/quote/stock/ELLIPTIC-LABORATORIES-ASA-113902294/news/Elliptic-Laboratories-Labs-Minutes-of-Annual-General-Meeting-46792977/,2024-05-22T10:02:15Z,"Oslo, 22 May 2024: The annual general meeting of Elliptic Laboratories ASA (""Elliptic Labs"" or the ""Company"") was held today. The minutes of the meeting, including appendices, are attached to this no… [+1724 chars]"
61,Marketscreener.com,NULL,"Enhanced Experian Ascend Technology Platform™ Transforms Software for Credit, Fraud and Analytics","(marketscreener.com) 
First-of-its-kind platform now integrates Experian’s market-leading data, generative AI and cutting-edge machine learning solutions into one unified interface

https://www.marketscreener.com/quote/stock/EXPERIAN-PLC-9590128/news/Enhanced…",https://www.marketscreener.com/quote/stock/EXPERIAN-PLC-9590128/news/Enhanced-Experian-Ascend-Technology-Platform-Transforms-Software-for-Credit-Fraud-and-Analytics-46792972/,2024-05-22T10:02:07Z,"First-of-its-kind platform now integrates Experians market-leading data, generative AI and cutting-edge machine learning solutions into one unified interface
As companies around the globe grapple wi… [+7845 chars]"
62,Financial Post,GlobeNewswire,ProcessMaker Wins Top Award as 2024 Best Generative AI Solution from SIIA CODiE,"Recognized for superior innovation, user-friendliness and problem solving through GenAI Durham, North Carolina, May 22, 2024 (GLOBE NEWSWIRE) — ProcessMaker, a business process automation platform, announces that ProcessMaker Platform was named the 2024 SIIA …",https://financialpost.com/globe-newswire/processmaker-wins-top-award-as-2024-best-generative-ai-solution-from-siia-codie,2024-05-22T10:01:45Z,"Recognized for superior innovation, user-friendliness and problem solving through GenAI
Durham, North Carolina, May 22, 2024 (GLOBE NEWSWIRE) ProcessMaker, a business process automation platform, an… [+3211 chars]"
63,Geeky Gadgets,Roland Hutchinson,How to Optimize ChatGPT GPT-4o Prompts,"In the realm of artificial intelligence, specifically within the landscape of language models like GPT-4o, the art of crafting effective prompts can significantly influence the quality and relevance of the generated responses. Optimizing prompts is essential …",https://www.geeky-gadgets.com/how-to-optimize-gpt-4o-prompts/,2024-05-22T10:01:27Z,"In the realm of artificial intelligence, specifically within the landscape of language models like GPT-4o, the art of crafting effective prompts can significantly influence the quality and relevance … [+9187 chars]"
64,Irunfar.com,Kristin Zosel,Nike Pegasus Trail 5 Review,"The post Nike Pegasus Trail 5 Review appeared first on iRunFar.
An in-depth review of the Nike Pegasus Trail 5 trail running shoes.
Nike Pegasus Trail 5 Review by Kristin Zosel.",https://www.irunfar.com/nike-pegasus-trail-5-review,2024-05-22T10:01:21Z,"The Nike Pegasus Trail 5. All photos: iRunFar/Bryon Powell
The Nike Pegasus Trail 5 ($150), like its predecessors, is my magic slipper of sorts for daily, non-technical singletrack running. It can a… [+9657 chars]"
65,Marketscreener.com,NULL,FusionIQ Announces Integration with Interactive Brokers Canada,"(marketscreener.com) 

Innovations for financial advisors, including FusionIQ's FIQ Journey product, now available to industry leaders in Canada
WOBURN, Mass., May 22, 2024 /PRNewswire/ -- FusionIQ, a leader in the delivery of cloud-based wealth management so…",https://www.marketscreener.com/quote/stock/INTERACTIVE-BROKERS-GROUP-50014/news/FusionIQ-Announces-Integration-with-Interactive-Brokers-Canada-46792956/,2024-05-22T10:01:13Z,"Innovations for financial advisors, including FusionIQ's FIQ Journey product, now available to industry leaders in Canada
WOBURN, Mass., May 22, 2024 /PRNewswire/ -- FusionIQ, a leader in the delive… [+4217 chars]"
66,Marketscreener.com,NULL,Wishpond Reports Q1-2024 Financial Results with Ongoing Revenue Growth and 39% Improvement in Adjusted EBITDA(1),"(marketscreener.com) 

Wishpond achieved revenue of $6.1 million in Q1-2024, representing an annualized revenue run-rate of over $24 million, driven by sales of the Company's next generation marketing platform, Propel IQ.Wishpond achieved Adjusted EBITDA of $…",https://www.marketscreener.com/quote/stock/WISHPOND-TECHNOLOGIES-LTD-122701099/news/Wishpond-Reports-Q1-2024-Financial-Results-with-Ongoing-Revenue-Growth-and-39-Improvement-in-Adjust-46792958/,2024-05-22T10:01:13Z,"<ul><li>Wishpond achieved revenue of $6.1 million in Q1-2024, representing an annualized revenue run-rate(1) of over $24 million, driven by sales of the Company's next generation marketing platform, … [+20443 chars]"
67,Marketscreener.com,NULL,"Waterdrop Inc. to Report First Quarter 2024 Financial Results on June 5, 2024","(marketscreener.com) 

BEIJING, May 22, 2024 /PRNewswire/ -- Waterdrop Inc. , a leading technology platform dedicated to insurance and healthcare service with a positive social impact, today announced that it will report its unaudited financial results for th…",https://www.marketscreener.com/quote/stock/WATERDROP-INC-122374816/news/Waterdrop-Inc-to-Report-First-Quarter-2024-Financial-Results-on-June-5-2024-46792953/,2024-05-22T10:01:12Z,"BEIJING, May 22, 2024 /PRNewswire/ -- Waterdrop Inc. (NYSE: WDH) (""Waterdrop"" or the ""Company""), a leading technology platform dedicated to insurance and healthcare service with a positive social imp… [+2493 chars]"
68,Marketscreener.com,NULL,KBR and Sumitomo Chemical Form Technology Licensing Alliance for Sustainable Propylene Oxide Production,"(marketscreener.com) 

HOUSTON, May 22, 2024 /PRNewswire/ -- KBR and Sumitomo Chemical announced today that they have signed an alliance agreement to make KBR an exclusive licensing partner for Sumitomo Chemical's state-of-the-art propylene oxide by cumene te…",https://www.marketscreener.com/quote/stock/KBR-INC-36548/news/KBR-and-Sumitomo-Chemical-Form-Technology-Licensing-Alliance-for-Sustainable-Propylene-Oxide-Product-46792954/,2024-05-22T10:01:12Z,"HOUSTON, May 22, 2024 /PRNewswire/ -- KBR (NYSE: KBR) and Sumitomo Chemical announced today that they have signed an alliance agreement to make KBR an exclusive licensing partner for Sumitomo Chemica… [+4821 chars]"
69,Marketscreener.com,NULL,Teledyne FLIR Defense Upgrades Surveillance Service Center Capability in Turkey,"(marketscreener.com) 
Capital investment in Periter A.S. operation enhances services and ensures majority of Turkish customer support needs are handled in-country

https://www.marketscreener.com/quote/stock/TELEDYNE-TECHNOLOGIES-INC-14569/news/Teledyne-FLIR-D…",https://www.marketscreener.com/quote/stock/TELEDYNE-TECHNOLOGIES-INC-14569/news/Teledyne-FLIR-Defense-Upgrades-Surveillance-Service-Center-Capability-in-Turkey-46792950/,2024-05-22T10:01:07Z,"Capital investment in Periter A.S. operation enhances services and ensures majority of Turkish customer support needs are handled in-country
Teledyne FLIR Defense recently completed a major upgrade … [+3660 chars]"
70,[Removed],NULL,[Removed],[Removed],https://removed.com,1970-01-01T00:00:00Z,[Removed]
71,[Removed],NULL,[Removed],[Removed],https://removed.com,1970-01-01T00:00:00Z,[Removed]
72,[Removed],NULL,[Removed],[Removed],https://removed.com,1970-01-01T00:00:00Z,[Removed]
73,Fox News,"Kurt Knutsson, CyberGuy Report",China unveils its first full-size electric running humanoid robot,"Tiangong is a full-size humanoid robot from China that stands as tall as an average human, can jog and is capable of running on electric power.",https://www.foxnews.com/tech/china-unveils-its-first-full-size-electric-running-humanoid-robot,2024-05-22T10:00:48Z,"Like it or not, soon our world is going to be filled with robots that walk among us, not as clunky machines of sci-fi films, but with the grace and agility of humans.
Take Tiangong, for example, a f… [+4442 chars]"
74,New York Magazine,Errol Louis,Why Are New York City Schools Still So Segregated?,"Seventy years after Brown v. Board, the city is refusing to deal with the problem, writes columnist Errol Louis.",http://nymag.com/intelligencer/article/why-are-new-york-city-schools-still-so-segregated.html,2024-05-22T10:00:42Z,"The 70th anniversary of the Supreme Courts Brown v. Board of Education decision, which outlawed racial segregation in public schools, came and went in New York with little official notice. Perhaps ou… [+5839 chars]"
75,Lenscratch.com,Kassandra Eller,THE CENTER AWARDS: ME&EVE GRANT: ANNA REED,"Congratulations to Anna Reed for being selected for CENTER’s Me&Eve Grant recognizing her project, Merging Dimensions. The Me&Eve Grant provides financial support to a woman, female-identified, non-binary, transgender, gender non-conforming, or two-spirited p…",http://lenscratch.com/2024/05/the-center-awards-meeve-grant-anna-reed/,2024-05-22T10:00:40Z,"© Anna Reed, Echo Chamber, from Merging Dimensions
Congratulations to Anna Reed for being selected for CENTERs Me&amp;Eve Grantrecognizing her project, Merging Dimensions. The Me&amp;Eve Grant provi… [+5916 chars]"
76,Soldiersystems.net,David Reeder,AimLock: Leading the Charge in Semi-Autonomous Weapons Tech,"Denver, CO – AimLock, a pivotal innovator in the defense industry, continues to redefine precision targeting and engagement capabilities with its state-of-the-art semi-autonomous weapon systems. Since its inception in 2009 and incorporation in 2013, AimLock h…",https://soldiersystems.net/2024/05/22/aimlock-leading-the-charge-in-semi-autonomous-weapons-tech/,2024-05-22T10:00:35Z,"Denver, CO  AimLock, a pivotal innovator in the defense industry, continues to redefine precision targeting and engagement capabilities with its state-of-the-art semi-autonomous weapon systems.
Sinc… [+3315 chars]"
77,Financial Post,Financial Times,"Now that everyone hates private equity, I’ll buy some",Why I am warming to private equity after decades of criticizing the industry. Find out more,https://financialpost.com/financial-times/everyone-hates-private-equity-so-buy-some,2024-05-22T10:00:27Z,"And I've found a way to do it that avoids the insane fees
Author of the article:
You share in the geared upside of assets managed by the likes of Blackstone Inc., KKR &amp; Co. Inc. and Apollo Glob… [+8755 chars]"
78,[Removed],NULL,[Removed],[Removed],https://removed.com,1970-01-01T00:00:00Z,[Removed]
